{
  "version": 1,
  "description": "Generated component implementation and certification status inventory.",
  "counts": {
    "total": 84,
    "byStatus": {
      "implemented_partial": 1,
      "scaffold_only": 83
    },
    "byCategory": {
      "containers": 19,
      "shapes": 13,
      "charts": 8,
      "controls": 13,
      "misc": 7,
      "choices": 4,
      "menus": 6,
      "content": 2,
      "media": 3,
      "data": 6,
      "text-inputs": 3
    }
  },
  "components": [
    {
      "tagName": "jfx-accordion",
      "category": "containers",
      "directory": "packages/components/src/containers/accordion",
      "componentStatus": "scaffold_only",
      "certificationStatus": "missing_implementation",
      "files": {
        "component": "packages/components/src/containers/accordion/jfx-accordion.ts",
        "template": "packages/components/src/containers/accordion/jfx-accordion.template.ts",
        "styles": "packages/components/src/containers/accordion/jfx-accordion.styles.css",
        "manifest": "packages/components/src/containers/accordion/jfx-accordion.manifest.json",
        "sources": "packages/components/src/containers/accordion/jfx-accordion.sources.json",
        "unitTest": "packages/components/src/containers/accordion/jfx-accordion.test.ts",
        "accessibilityTest": "packages/components/src/containers/accordion/jfx-accordion.a11y.test.ts"
      },
      "sourceCount": 0
    },
    {
      "tagName": "jfx-anchor-pane",
      "category": "containers",
      "directory": "packages/components/src/containers/anchor-pane",
      "componentStatus": "scaffold_only",
      "certificationStatus": "missing_implementation",
      "files": {
        "component": "packages/components/src/containers/anchor-pane/jfx-anchor-pane.ts",
        "template": "packages/components/src/containers/anchor-pane/jfx-anchor-pane.template.ts",
        "styles": "packages/components/src/containers/anchor-pane/jfx-anchor-pane.styles.css",
        "manifest": "packages/components/src/containers/anchor-pane/jfx-anchor-pane.manifest.json",
        "sources": "packages/components/src/containers/anchor-pane/jfx-anchor-pane.sources.json",
        "unitTest": "packages/components/src/containers/anchor-pane/jfx-anchor-pane.test.ts",
        "accessibilityTest": "packages/components/src/containers/anchor-pane/jfx-anchor-pane.a11y.test.ts"
      },
      "sourceCount": 0
    },
    {
      "tagName": "jfx-arc",
      "category": "shapes",
      "directory": "packages/components/src/shapes/arc",
      "componentStatus": "scaffold_only",
      "certificationStatus": "missing_implementation",
      "files": {
        "component": "packages/components/src/shapes/arc/jfx-arc.ts",
        "template": "packages/components/src/shapes/arc/jfx-arc.template.ts",
        "styles": "packages/components/src/shapes/arc/jfx-arc.styles.css",
        "manifest": "packages/components/src/shapes/arc/jfx-arc.manifest.json",
        "sources": "packages/components/src/shapes/arc/jfx-arc.sources.json",
        "unitTest": "packages/components/src/shapes/arc/jfx-arc.test.ts",
        "accessibilityTest": "packages/components/src/shapes/arc/jfx-arc.a11y.test.ts"
      },
      "sourceCount": 0
    },
    {
      "tagName": "jfx-area-chart",
      "category": "charts",
      "directory": "packages/components/src/charts/area-chart",
      "componentStatus": "scaffold_only",
      "certificationStatus": "missing_implementation",
      "files": {
        "component": "packages/components/src/charts/area-chart/jfx-area-chart.ts",
        "template": "packages/components/src/charts/area-chart/jfx-area-chart.template.ts",
        "styles": "packages/components/src/charts/area-chart/jfx-area-chart.styles.css",
        "manifest": "packages/components/src/charts/area-chart/jfx-area-chart.manifest.json",
        "sources": "packages/components/src/charts/area-chart/jfx-area-chart.sources.json",
        "unitTest": "packages/components/src/charts/area-chart/jfx-area-chart.test.ts",
        "accessibilityTest": "packages/components/src/charts/area-chart/jfx-area-chart.a11y.test.ts"
      },
      "sourceCount": 0
    },
    {
      "tagName": "jfx-bar-chart",
      "category": "charts",
      "directory": "packages/components/src/charts/bar-chart",
      "componentStatus": "scaffold_only",
      "certificationStatus": "missing_implementation",
      "files": {
        "component": "packages/components/src/charts/bar-chart/jfx-bar-chart.ts",
        "template": "packages/components/src/charts/bar-chart/jfx-bar-chart.template.ts",
        "styles": "packages/components/src/charts/bar-chart/jfx-bar-chart.styles.css",
        "manifest": "packages/components/src/charts/bar-chart/jfx-bar-chart.manifest.json",
        "sources": "packages/components/src/charts/bar-chart/jfx-bar-chart.sources.json",
        "unitTest": "packages/components/src/charts/bar-chart/jfx-bar-chart.test.ts",
        "accessibilityTest": "packages/components/src/charts/bar-chart/jfx-bar-chart.a11y.test.ts"
      },
      "sourceCount": 0
    },
    {
      "tagName": "jfx-border-pane",
      "category": "containers",
      "directory": "packages/components/src/containers/border-pane",
      "componentStatus": "scaffold_only",
      "certificationStatus": "missing_implementation",
      "files": {
        "component": "packages/components/src/containers/border-pane/jfx-border-pane.ts",
        "template": "packages/components/src/containers/border-pane/jfx-border-pane.template.ts",
        "styles": "packages/components/src/containers/border-pane/jfx-border-pane.styles.css",
        "manifest": "packages/components/src/containers/border-pane/jfx-border-pane.manifest.json",
        "sources": "packages/components/src/containers/border-pane/jfx-border-pane.sources.json",
        "unitTest": "packages/components/src/containers/border-pane/jfx-border-pane.test.ts",
        "accessibilityTest": "packages/components/src/containers/border-pane/jfx-border-pane.a11y.test.ts"
      },
      "sourceCount": 0
    },
    {
      "tagName": "jfx-box",
      "category": "shapes",
      "directory": "packages/components/src/shapes/box",
      "componentStatus": "scaffold_only",
      "certificationStatus": "missing_implementation",
      "files": {
        "component": "packages/components/src/shapes/box/jfx-box.ts",
        "template": "packages/components/src/shapes/box/jfx-box.template.ts",
        "styles": "packages/components/src/shapes/box/jfx-box.styles.css",
        "manifest": "packages/components/src/shapes/box/jfx-box.manifest.json",
        "sources": "packages/components/src/shapes/box/jfx-box.sources.json",
        "unitTest": "packages/components/src/shapes/box/jfx-box.test.ts",
        "accessibilityTest": "packages/components/src/shapes/box/jfx-box.a11y.test.ts"
      },
      "sourceCount": 0
    },
    {
      "tagName": "jfx-bubble-chart",
      "category": "charts",
      "directory": "packages/components/src/charts/bubble-chart",
      "componentStatus": "scaffold_only",
      "certificationStatus": "missing_implementation",
      "files": {
        "component": "packages/components/src/charts/bubble-chart/jfx-bubble-chart.ts",
        "template": "packages/components/src/charts/bubble-chart/jfx-bubble-chart.template.ts",
        "styles": "packages/components/src/charts/bubble-chart/jfx-bubble-chart.styles.css",
        "manifest": "packages/components/src/charts/bubble-chart/jfx-bubble-chart.manifest.json",
        "sources": "packages/components/src/charts/bubble-chart/jfx-bubble-chart.sources.json",
        "unitTest": "packages/components/src/charts/bubble-chart/jfx-bubble-chart.test.ts",
        "accessibilityTest": "packages/components/src/charts/bubble-chart/jfx-bubble-chart.a11y.test.ts"
      },
      "sourceCount": 0
    },
    {
      "tagName": "jfx-button",
      "category": "controls",
      "directory": "packages/components/src/controls/button",
      "componentStatus": "implemented_partial",
      "certificationStatus": "not_certified_behavior_visual_a11y_incomplete",
      "files": {
        "component": "packages/components/src/controls/button/jfx-button.ts",
        "template": "packages/components/src/controls/button/jfx-button.template.ts",
        "styles": "packages/components/src/controls/button/jfx-button.styles.css",
        "manifest": "packages/components/src/controls/button/jfx-button.manifest.json",
        "sources": "packages/components/src/controls/button/jfx-button.sources.json",
        "unitTest": "packages/components/src/controls/button/jfx-button.test.ts",
        "accessibilityTest": "packages/components/src/controls/button/jfx-button.a11y.test.ts"
      },
      "sourceCount": 10
    },
    {
      "tagName": "jfx-button-bar",
      "category": "containers",
      "directory": "packages/components/src/containers/button-bar",
      "componentStatus": "scaffold_only",
      "certificationStatus": "missing_implementation",
      "files": {
        "component": "packages/components/src/containers/button-bar/jfx-button-bar.ts",
        "template": "packages/components/src/containers/button-bar/jfx-button-bar.template.ts",
        "styles": "packages/components/src/containers/button-bar/jfx-button-bar.styles.css",
        "manifest": "packages/components/src/containers/button-bar/jfx-button-bar.manifest.json",
        "sources": "packages/components/src/containers/button-bar/jfx-button-bar.sources.json",
        "unitTest": "packages/components/src/containers/button-bar/jfx-button-bar.test.ts",
        "accessibilityTest": "packages/components/src/containers/button-bar/jfx-button-bar.a11y.test.ts"
      },
      "sourceCount": 0
    },
    {
      "tagName": "jfx-canvas",
      "category": "misc",
      "directory": "packages/components/src/misc/canvas",
      "componentStatus": "scaffold_only",
      "certificationStatus": "missing_implementation",
      "files": {
        "component": "packages/components/src/misc/canvas/jfx-canvas.ts",